[
  {
    "rank": 123,
    "name": "Abasyn University",
    "location": "Peshawar ...",
    "href": "/reviews/11019.htm",
    "tags": ["private", "for-profit", "small-sized", "averagely selective"],
    "description": "Founded in 2007, the Abasyn University is a for-profit private higher education institution located in the urban setting of the metropolis of Peshawar (population range of 1,000,000-5,000,000 inhabitants), Khyber Pakhtunkhwa. This institution also has a branch campus in Islamabad. Officially recognized by the Higher Education Commission of Pakistan, Abasyn University (AU) is a small-sized (uniRank enrollment range: 4,000-4,999 students) coeducational Pakistani higher education institution formally affiliated with the Islamic religion. Abasyn University (AU) offers courses and programs leading to officially recognized higher education degrees such as bachelor's degrees, master's degrees and doctorate degrees in several areas of study. See the uniRank degree levels and areas of study table below for further details. This 16-year-old Pakistani higher-education institution has a selective admission policy based on students' past academic records and grades. The acceptance rate range is 50-59% making this Pakistani higher education organization an averagely selective institution. International students are welcome to apply for enrollment. AU also provides several academic and non-academic facilities and services to students including a library, sports facilities, financial aids and/or scholarships, study abroad and exchange programs, as well as administrative services.",
    "field": {
      "Arts & Humanities ": ["-", "Bachelor's", "Master's", "-"],
      "Language & Cultural ": ["-", "-", "-", "-"],
      "Business & Social Sciences ": [
        "-",
        "Bachelor's",
        "Master's",
        "Doctorate"
      ],
      "Medicine & Health ": ["-", "Bachelor's", "Master's", "-"],
      "Science & Technology ": ["-", "Bachelor's", "Master's", "Doctorate"],
      "Engineering ": ["-", "Bachelor's", "Master's", "Doctorate"]
    },
    "fee": {
      "Localstudents": [
        "1,000-2,499 US$(910-2,280 Euro)",
        "1,000-2,499 US$(910-2,280 Euro)"
      ],
      "Internationalstudents": [
        "2,500-4,999 US$(2,280-4,555 Euro)",
        "2,500-4,999 US$(2,280-4,555 Euro)"
      ]
    },
    "image_url": "https://www.4icu.org/i/logos-seals/11019.png"
  },
  {
    "rank": 160,
    "name": "Abbottabad University of Science and Technology",
    "location": "Abbottabad",
    "href": "/reviews/17715.htm",
    "tags": ["public", "non-profit", "not reported", "not reported"],
    "description": "Founded in 2015, the Abbottabad University of Science and Technology is a non-profit public higher education institution located in the urban setting of the small city of Abbottabad (population range of 50,000-249,999 inhabitants), Khyber Pakhtunkhwa. Officially recognized by the Higher Education Commission of Pakistan, Abbottabad University of Science and Technology (AUST) is a coeducational Pakistani higher education institution. Abbottabad University of Science and Technology (AUST) offers courses and programs leading to officially recognized higher education degrees such as bachelor's degrees and master's degrees in several areas of study. See the uniRank degree levels and areas of study table below for further details. This 8-year-old Pakistani higher-education institution has a selective admission policy based on entrance examinations and students' past academic records and grades. AUST also provides several academic and non-academic facilities and services to students including as well as administrative services.",
    "field": {
      "Arts & Humanities ": ["-", "Bachelor's", "Master's", "-"],
      "Language & Cultural ": ["-", "-", "-", "-"],
      "Business & Social Sciences ": ["-", "Bachelor's", "Master's", "-"],
      "Medicine & Health ": ["-", "-", "-", "-"],
      "Science & Technology ": ["-", "Bachelor's", "Master's", "-"],
      "Engineering ": ["-", "Bachelor's", "Master's", "-"]
    },
    "fee": {
      "Localstudents": ["Not reported", "Not reported"],
      "Internationalstudents": ["Not reported", "Not reported"]
    },
    "image_url": "https://www.4icu.org/i/logos-seals/17715.png"
  },
  {
    "rank": 90,
    "name": "Abdul Wali Khan University Mardan",
    "location": "Mardan ...",
    "href": "/reviews/14616.htm",
    "tags": ["public", "non-profit", "large-sized", "averagely selective"],
    "description": "Established in 2009, the Abdul Wali Khan University Mardan is a non-profit public higher education institution located in the urban setting of the metropolis of Mardan (population range of 1,000,000-5,000,000 inhabitants), Khyber Pakhtunkhwa. This institution also has branch campuses in Garden, Pabbi and Timergara. Officially recognized by the Higher Education Commission of Pakistan, Abdul Wali Khan University Mardan (AWKUM) is a large-sized (uniRank enrollment range: 10,000-14,999 students) coeducational Pakistani higher education institution. Abdul Wali Khan University Mardan (AWKUM) offers courses and programs leading to officially recognized higher education degrees such as bachelor's degrees, master's degrees and doctorate degrees in several areas of study. See the uniRank degree levels and areas of study table below for further details. This 15-year-old Pakistani higher-education institution has a selective admission policy based on students' past academic records and grades. The acceptance rate range is 40-49% making this Pakistani higher education organization an averagely selective institution. International applicants are eligible to apply for enrollment. AWKUM also provides several academic and non-academic facilities and services to students including study abroad and exchange programs, online courses and distance learning opportunities, as well as administrative services.",
    "field": {
      "Arts & Humanities ": ["-", "Bachelor's", "Master's", "Doctorate"],
      "Language & Cultural ": ["-", "Bachelor's", "Master's", "-"],
      "Business & Social Sciences ": [
        "-",
        "Bachelor's",
        "Master's",
        "Doctorate"
      ],
      "Medicine & Health ": ["-", "-", "-", "-"],
      "Science & Technology ": ["-", "Bachelor's", "Master's", "Doctorate"],
      "Engineering ": ["-", "-", "-", "-"]
    },
    "fee": {
      "Localstudents": [
        "1,000-2,499 US$(910-2,280 Euro)",
        "2,500-4,999 US$(2,280-4,555 Euro)"
      ],
      "Internationalstudents": [
        "1,000-2,499 US$(910-2,280 Euro)",
        "2,500-4,999 US$(2,280-4,555 Euro)"
      ]
    },
    "image_url": "https://www.4icu.org/i/logos-seals/14616.png"
  },
  {
    "rank": 1,
    "name": "Aga Khan University",
    "location": "Karachi ...",
    "href": "/reviews/3488.htm",
    "tags": ["private", "non-profit", "very small-sized", "not reported"],
    "description": "Established in 1983, the Aga Khan University is a non-profit private higher education institution located in the urban setting of the large metropolis of Karachi (population range of over 5,000,000 inhabitants), Sindh. This institution also has branch campuses in London, Nairobi, Kampala, Dar es Salaam and Kabul. Officially recognized by the Higher Education Commission of Pakistan, Aga Khan University (AKU) is a very small-sized (uniRank enrollment range: 1,000-1,999 students) coeducational Pakistani higher education institution. Aga Khan University (AKU) offers courses and programs leading to officially recognized higher education degrees such as pre-bachelor's degrees (i.e. certificates, diplomas, associate or foundation), bachelor's degrees, master's degrees and doctorate degrees in several areas of study. See the uniRank degree levels and areas of study table below for further details. This 40-year-old Pakistani higher-education institution has a selective admission policy based on entrance examinations and students' past academic records and grades. International applicants are eligible to apply for enrollment. AKU also provides several academic and non-academic facilities and services to students including a library, housing, sports facilities, financial aids and/or scholarships, study abroad and exchange programs, as well as administrative services.",
    "field": {
      "Arts & Humanities ": ["-", "Bachelor's", "Master's", "Doctorate"],
      "Language & Cultural ": ["-", "-", "Master's", "-"],
      "Business & Social Sciences ": ["-", "-", "Master's", "-"],
      "Medicine & Health ": ["Diploma", "Bachelor's", "Master's", "Doctorate"],
      "Science & Technology ": ["-", "-", "-", "-"],
      "Engineering ": ["-", "-", "-", "-"]
    },
    "fee": {
      "Localstudents": [
        "2,500-4,999 US$(2,280-4,555 Euro)",
        "2,500-4,999 US$(2,280-4,555 Euro)"
      ],
      "Internationalstudents": [
        "17,500-19,999 US$(15,950-18,225 Euro)",
        "17,500-19,999 US$(15,950-18,225 Euro)"
      ]
    },
    "image_url": "https://www.4icu.org/i/logos-seals/3488.png"
  },
  {
    "rank": 37,
    "name": "Air University",
    "location": "Islamabad ...",
    "href": "/reviews/7536.htm",
    "tags": ["public", "non-profit", "medium-sized", "not reported"],
    "description": "Established in 2002, the Air University is a non-profit public higher education institution located in the metropolis of Islamabad (population range of 1,000,000-5,000,000 inhabitants), Islamabad CT. This institution also has a branch campus in Multan. Officially recognized by the Higher Education Commission of Pakistan, Air University (AU) is a medium-sized (uniRank enrollment range: 6,000-6,999 students) coeducational Pakistani higher education institution. Air University (AU) offers courses and programs leading to officially recognized higher education degrees such as bachelor's degrees in several areas of study. See the uniRank degree levels and areas of study table below for further details. This 21-year-old Pakistani higher-education institution has a selective admission policy based on entrance examinations and students' past academic records and grades. AU also provides several academic and non-academic facilities and services to students including a library, as well as administrative services.",
    "field": {
      "Arts & Humanities ": ["-", "-", "-", "-"],
      "Language & Cultural ": ["-", "-", "-", "-"],
      "Business & Social Sciences ": ["-", "Bachelor's", "-", "-"],
      "Medicine & Health ": ["-", "-", "-", "-"],
      "Science & Technology ": ["-", "Bachelor's", "-", "-"],
      "Engineering ": ["-", "Bachelor's", "-", "-"]
    },
    "fee": {
      "Localstudents": ["Not reported", "Not reported"],
      "Internationalstudents": ["Not reported", "Not reported"]
    },
    "image_url": "https://www.4icu.org/i/logos-seals/7536.png"
  },
  {
    "rank": 150,
    "name": "Al-Hamd Islamic University",
    "location": "Quetta ...",
    "href": "/reviews/12321.htm",
    "tags": [
      "private",
      "for-profit",
      "very small-sized",
      "averagely selective"
    ],
    "description": "Founded in 2005, the Al-Hamd Islamic University is a for-profit private higher education institution located in the urban setting of the metropolis of Quetta (population range of 1,000,000-5,000,000 inhabitants), Balochistan. This institution also has a branch campus in Islamabad. Officially recognized by the Higher Education Commission of Pakistan, Al-Hamd Islamic University (AIU) is a very small-sized (uniRank enrollment range: 500-999 students) coeducational Pakistani higher education institution formally affiliated with the Islamic religion. Al-Hamd Islamic University (AIU) offers courses and programs leading to officially recognized higher education degrees such as pre-bachelor's degrees (i.e. certificates, diplomas, associate or foundation), bachelor's degrees, master's degrees and doctorate degrees in several areas of study. See the uniRank degree levels and areas of study table below for further details. This 18-year-old Pakistani higher-education institution has a selective admission policy based on entrance examinations and students' past academic records and grades. The acceptance rate range is 40-49% making this Pakistani higher education organization an averagely selective institution. AIU also provides several academic and non-academic facilities and services to students including a library, sports facilities, financial aids and/or scholarships, online courses and distance learning opportunities, as well as administrative services.",
    "field": {
      "Arts & Humanities ": ["-", "-", "-", "-"],
      "Language & Cultural ": ["-", "-", "-", "-"],
      "Business & Social Sciences ": [
        "Diploma",
        "Bachelor's",
        "Master's",
        "Doctorate"
      ],
      "Medicine & Health ": ["-", "-", "-", "-"],
      "Science & Technology ": ["-", "-", "-", "-"],
      "Engineering ": ["-", "-", "-", "-"]
    },
    "fee": {
      "Localstudents": [
        "1,000-2,499 US$(910-2,280 Euro)",
        "2,500-4,999 US$(2,280-4,555 Euro)"
      ],
      "Internationalstudents": ["Not reported", "Not reported"]
    },
    "image_url": "https://www.4icu.org/i/logos-seals/12321.png"
  },
  {
    "rank": 169,
    "name": "Ali Institute of Education",
    "location": "Lahore",
    "href": "/reviews/15192.htm",
    "tags": ["private", "not reported", "very small-sized", "not reported"],
    "description": "Established in 2010, the Ali Institute of Education is a private higher education institution located in the large metropolis of Lahore (population range of over 5,000,000 inhabitants), Punjab. Officially recognized by the Higher Education Commission of Pakistan, Ali Institute of Education (AIE) is a very small-sized (uniRank enrollment range: under-250 students) coeducational Pakistani higher education institution. Ali Institute of Education (AIE) offers courses and programs leading to officially recognized higher education degrees such as bachelor's degrees in several areas of study. See the uniRank degree levels and areas of study table below for further details. This 14-year-old Pakistani higher-education institution has a selective admission policy based on entrance examinations and students' past academic records and grades. AIE also provides several academic and non-academic facilities and services to students including a library, as well as administrative services.",
    "field": {
      "Arts & Humanities ": ["-", "-", "-", "-"],
      "Language & Cultural ": ["-", "-", "-", "-"],
      "Business & Social Sciences ": ["-", "Bachelor's", "-", "-"],
      "Medicine & Health ": ["-", "-", "-", "-"],
      "Science & Technology ": ["-", "Bachelor's", "-", "-"],
      "Engineering ": ["-", "-", "-", "-"]
    },
    "fee": {
      "Localstudents": ["Not reported", "Not reported"],
      "Internationalstudents": ["Not reported", "Not reported"]
    },
    "image_url": "https://www.4icu.org/i/logos-seals/15192.png"
  },
  {
    "rank": 114,
    "name": "Bacha Khan University",
    "location": "Charsadda",
    "href": "/reviews/15180.htm",
    "tags": ["public", "non-profit", "small-sized", "not reported"],
    "description": "Established in 2012, the Bacha Khan University is a non-profit public higher education institution located in the metropolis of Charsadda (population range of 1,000,000-5,000,000 inhabitants), Khyber Pakhtunkhwa. Officially recognized by the Higher Education Commission of Pakistan, Bacha Khan University is a small-sized (uniRank enrollment range: 2,000-2,999 students) coeducational Pakistani higher education institution. Bacha Khan University offers courses and programs leading to officially recognized higher education degrees in several areas of study. See the uniRank degree levels and areas of study table below for further details. This 11-year-old Pakistani higher-education institution has a selective admission policy based on entrance examinations and students' past academic records and grades. Bacha Khan University also provides several academic and non-academic facilities and services to students including a library, as well as administrative services.",
    "field": {
      "Arts & Humanities ": ["-", "-", "-", "-"],
      "Language & Cultural ": ["-", "-", "-", "-"],
      "Business & Social Sciences ": ["-", "-", "-", "-"],
      "Medicine & Health ": ["-", "-", "-", "-"],
      "Science & Technology ": ["-", "-", "-", "-"],
      "Engineering ": ["-", "-", "-", "-"]
    },
    "fee": {
      "Localstudents": ["Not reported", "Not reported"],
      "Internationalstudents": ["Not reported", "Not reported"]
    },
    "image_url": "https://www.4icu.org/i/logos-seals/15180.png"
  },
  {
    "rank": 21,
    "name": "Bahauddin Zakariya University",
    "location": "Multan ...",
    "href": "/reviews/3494.htm",
    "tags": ["public", "non-profit", "large-sized", "not reported"],
    "description": "Established in 1975, the Bahauddin Zakariya University is a non-profit public higher education institution located in the metropolis of Multan (population range of 1,000,000-5,000,000 inhabitants), Punjab. This institution also has a branch campus in Layyah. Officially recognized by the Higher Education Commission of Pakistan, Bahauddin Zakariya University (BZU) is a large-sized (uniRank enrollment range: 25,000-29,999 students) coeducational Pakistani higher education institution. Bahauddin Zakariya University (BZU) offers courses and programs leading to officially recognized higher education degrees such as bachelor's degrees in several areas of study. See the uniRank degree levels and areas of study table below for further details. This 48-year-old Pakistani higher-education institution has a selective admission policy based on entrance examinations and students' past academic records and grades. BZU also provides several academic and non-academic facilities and services to students including a library, housing, as well as administrative services.",
    "field": {
      "Arts & Humanities ": ["-", "Bachelor's", "-", "-"],
      "Language & Cultural ": ["-", "Bachelor's", "-", "-"],
      "Business & Social Sciences ": ["-", "Bachelor's", "-", "-"],
      "Medicine & Health ": ["-", "Bachelor's", "-", "-"],
      "Science & Technology ": ["-", "Bachelor's", "-", "-"],
      "Engineering ": ["-", "Bachelor's", "-", "-"]
    },
    "fee": {
      "Localstudents": ["Not reported", "Not reported"],
      "Internationalstudents": ["Not reported", "Not reported"]
    },
    "image_url": "https://www.4icu.org/i/logos-seals/3494.png"
  },
  {
    "rank": 12,
    "name": "Bahria University",
    "location": "Islamabad ...",
    "href": "/reviews/3495.htm",
    "tags": ["public", "non-profit", "large-sized", "not reported"],
    "description": "Founded in 2000, the Bahria University is a non-profit public higher education institution located in the urban setting of the metropolis of Islamabad (population range of 1,000,000-5,000,000 inhabitants), Islamabad CT. This institution also has a branch campus in Karachi and Lahore. Officially recognized by the Higher Education Commission of Pakistan, Bahria University (BU) is a large-sized (uniRank enrollment range: 15,000-19,999 students) coeducational Pakistani higher education institution. Bahria University (BU) offers courses and programs leading to officially recognized higher education degrees such as bachelor's degrees in several areas of study. See the uniRank degree levels and areas of study table below for further details. This 24-year-old Pakistani higher-education institution has a selective admission policy based on entrance examinations and students' past academic records and grades. International students are welcome to apply for enrollment. BU also provides several academic and non-academic facilities and services to students including a library, housing, financial aids and/or scholarships, as well as administrative services.",
    "field": {
      "Arts & Humanities ": ["-", "-", "-", "-"],
      "Language & Cultural ": ["-", "-", "-", "-"],
      "Business & Social Sciences ": ["-", "Bachelor's", "-", "-"],
      "Medicine & Health ": ["-", "-", "-", "-"],
      "Science & Technology ": ["-", "Bachelor's", "-", "-"],
      "Engineering ": ["-", "Bachelor's", "-", "-"]
    },
    "fee": {
      "Localstudents": ["Not reported", "Not reported"],
      "Internationalstudents": ["Not reported", "Not reported"]
    },
    "image_url": "https://www.4icu.org/i/logos-seals/3495.png"
  },
  {
    "rank": 96,
    "name": "Balochistan University of Engineering and Technology",
    "location": "Khuzdar",
    "href": "/reviews/7538.htm",
    "tags": ["public", "non-profit", "very small-sized", "averagely selective"],
    "description": "Established in 1994, the Balochistan University of Engineering and Technology is a non-profit public higher education institution located in the suburban setting of the small city of Khuzdar (population range of 50,000-249,999 inhabitants), Balochistan. Officially recognized by the Higher Education Commission of Pakistan, Balochistan University of Engineering and Technology (BUETK) is a very small-sized (uniRank enrollment range: 1,000-1,999 students) coeducational Pakistani higher education institution. Balochistan University of Engineering and Technology (BUETK) offers courses and programs leading to officially recognized higher education degrees such as bachelor's degrees in several areas of study. See the uniRank degree levels and areas of study table below for further details. This 29-year-old Pakistani higher-education institution has a selective admission policy based on entrance examinations and students' past academic records and grades. The acceptance rate range is 40-49% making this Pakistani higher education organization an averagely selective institution. International applicants are eligible to apply for enrollment. BUETK also provides several academic and non-academic facilities and services to students including a library, sports facilities, as well as administrative services.",
    "field": {
      "Arts & Humanities ": ["-", "-", "-", "-"],
      "Language & Cultural ": ["-", "-", "-", "-"],
      "Business & Social Sciences ": ["-", "-", "-", "-"],
      "Medicine & Health ": ["-", "-", "-", "-"],
      "Science & Technology ": ["-", "Bachelor's", "-", "-"],
      "Engineering ": ["-", "Bachelor's", "-", "-"]
    },
    "fee": {
      "Localstudents": ["Not reported", "Not reported"],
      "Internationalstudents": ["Not reported", "Not reported"]
    },
    "image_url": "https://www.4icu.org/i/logos-seals/7538.png"
  },
  {
    "rank": 63,
    "name": "Balochistan University of Information Technology, Engineering and Management Sciences",
    "location": "Quetta",
    "href": "/reviews/3496.htm",
    "tags": ["public", "non-profit", "large-sized", "very selective"],
    "description": "Established in 2002, the Balochistan University of Information Technology, Engineering and Management Sciences is a non-profit public higher education institution located in the urban setting of the metropolis of Quetta (population range of 1,000,000-5,000,000 inhabitants), Balochistan. Officially recognized by the Higher Education Commission of Pakistan, Balochistan University of Information Technology, Engineering and Management Sciences (BUITEMS) is a large-sized (uniRank enrollment range: 10,000-14,999 students) coeducational Pakistani higher education institution. Balochistan University of Information Technology, Engineering and Management Sciences (BUITEMS) offers courses and programs leading to officially recognized higher education degrees such as bachelor's degrees, master's degrees and doctorate degrees in several areas of study. See the uniRank degree levels and areas of study table below for further details. This 21-year-old Pakistani higher-education institution has a selective admission policy based on entrance examinations and students' past academic records and grades. The acceptance rate range is 20-29% making this Pakistani higher education organization a very selective institution. International applicants are eligible to apply for enrollment. BUITEMS also provides several academic and non-academic facilities and services to students including a library, housing, sports facilities, financial aids and/or scholarships, study abroad and exchange programs, as well as administrative services.",
    "field": {
      "Arts & Humanities ": ["-", "Bachelor's", "Master's", "Doctorate"],
      "Language & Cultural ": ["-", "Bachelor's", "Master's", "-"],
      "Business & Social Sciences ": [
        "-",
        "Bachelor's",
        "Master's",
        "Doctorate"
      ],
      "Medicine & Health ": ["-", "-", "-", "-"],
      "Science & Technology ": ["-", "Bachelor's", "Master's", "Doctorate"],
      "Engineering ": ["-", "Bachelor's", "Master's", "Doctorate"]
    },
    "fee": {
      "Localstudents": ["0-999 US$(0-910 Euro)", "0-999 US$(0-910 Euro)"],
      "Internationalstudents": [
        "1,000-2,499 US$(910-2,280 Euro)",
        "1,000-2,499 US$(910-2,280 Euro)"
      ]
    },
    "image_url": "https://www.4icu.org/i/logos-seals/3496.png"
  },
  {
    "rank": 98,
    "name": "Baqai Medical University",
    "location": "Karachi",
    "href": "/reviews/3497.htm",
    "tags": ["private", "not reported", "very small-sized", "not reported"],
    "description": "Founded in 1996, the Baqai Medical University is a private higher education institution located in the large metropolis of Karachi (population range of over 5,000,000 inhabitants), Sindh. Officially recognized by the Higher Education Commission of Pakistan, Baqai Medical University (BMU) is a very small-sized (uniRank enrollment range: 1,000-1,999 students) coeducational Pakistani higher education institution. Baqai Medical University (BMU) offers courses and programs leading to officially recognized higher education degrees such as bachelor's degrees in several areas of study. See the uniRank degree levels and areas of study table below for further details. This 27-year-old Pakistani higher-education institution has a selective admission policy based on entrance examinations. BMU also provides several academic and non-academic facilities and services to students including a library, sports facilities, as well as administrative services.",
    "field": {
      "Arts & Humanities ": ["-", "Bachelor's", "-", "-"],
      "Language & Cultural ": ["-", "-", "-", "-"],
      "Business & Social Sciences ": ["-", "Bachelor's", "-", "-"],
      "Medicine & Health ": ["-", "Bachelor's", "-", "-"],
      "Science & Technology ": ["-", "Bachelor's", "-", "-"],
      "Engineering ": ["-", "-", "-", "-"]
    },
    "fee": {
      "Localstudents": ["Not reported", "Not reported"],
      "Internationalstudents": ["Not reported", "Not reported"]
    },
    "image_url": "https://www.4icu.org/i/logos-seals/3497.png"
  },
  {
    "rank": 102,
    "name": "Beaconhouse National University",
    "location": "Lahore",
    "href": "/reviews/7568.htm",
    "tags": ["private", "non-profit", "very small-sized", "not reported"],
    "description": "Established in 2005, the Beaconhouse National University is a non-profit private higher education institution located in the urban setting of the large metropolis of Lahore (population range of over 5,000,000 inhabitants), Punjab. Officially recognized by the Higher Education Commission of Pakistan, Beaconhouse National University (BNU) is a very small-sized (uniRank enrollment range: 1,000-1,999 students) coeducational Pakistani higher education institution. Beaconhouse National University (BNU) offers courses and programs leading to officially recognized higher education degrees such as bachelor's degrees, master's degrees and doctorate degrees in several areas of study. See the uniRank degree levels and areas of study table below for further details. This 18-year-old Pakistani higher-education institution has a selective admission policy based on entrance examinations and students' past academic records and grades. International applicants are eligible to apply for enrollment. BNU also provides several academic and non-academic facilities and services to students including a library, housing, sports facilities, financial aids and/or scholarships, study abroad and exchange programs, as well as administrative services.",
    "field": {
      "Arts & Humanities ": ["-", "-", "Master's", "Doctorate"],
      "Language & Cultural ": ["-", "Bachelor's", "-", "-"],
      "Business & Social Sciences ": ["-", "Bachelor's", "Master's", "-"],
      "Medicine & Health ": ["-", "-", "-", "-"],
      "Science & Technology ": ["-", "Bachelor's", "Master's", "-"],
      "Engineering ": ["-", "-", "-", "-"]
    },
    "fee": {
      "Localstudents": ["Not reported", "Not reported"],
      "Internationalstudents": ["Not reported", "Not reported"]
    },
    "image_url": "https://www.4icu.org/i/logos-seals/7568.png"
  },
  {
    "rank": 164,
    "name": "Benazir Bhutto Shaheed University Lyari",
    "location": "Karachi",
    "href": "/reviews/15175.htm",
    "tags": ["public", "non-profit", "very small-sized", "not reported"],
    "description": "Founded in 2010, the Benazir Bhutto Shaheed University Lyari is a non-profit public higher education institution located in the large metropolis of Karachi (population range of over 5,000,000 inhabitants), Sindh. Officially recognized by the Higher Education Commission of Pakistan, Benazir Bhutto Shaheed University Lyari (BBSUL) is a very small-sized (uniRank enrollment range: 1,000-1,999 students) coeducational Pakistani higher education institution. Benazir Bhutto Shaheed University Lyari (BBSUL) offers courses and programs leading to officially recognized higher education degrees such as bachelor's degrees in several areas of study. See the uniRank degree levels and areas of study table below for further details. This 14-year-old Pakistani higher-education institution has a selective admission policy based on entrance examinations and students' past academic records and grades. BBSUL also provides several academic and non-academic facilities and services to students including a library, as well as administrative services.",
    "field": {
      "Arts & Humanities ": ["-", "Bachelor's", "-", "-"],
      "Language & Cultural ": ["-", "-", "-", "-"],
      "Business & Social Sciences ": ["-", "Bachelor's", "-", "-"],
      "Medicine & Health ": ["-", "-", "-", "-"],
      "Science & Technology ": ["-", "Bachelor's", "-", "-"],
      "Engineering ": ["-", "-", "-", "-"]
    },
    "fee": {
      "Localstudents": ["Not reported", "Not reported"],
      "Internationalstudents": ["Not reported", "Not reported"]
    },
    "image_url": "https://www.4icu.org/i/logos-seals/15175.png"
  },
  {
    "rank": 176,
    "name": "Benazir Bhutto Shaheed University of Technology and Skill Development",
    "location": "Khairpur",
    "href": "/reviews/18791.htm",
    "tags": ["not reported", "not reported", "not reported", "not reported"],
    "description": "Founded in 2016, the Benazir Bhutto Shaheed University of Technology and Skill Development is a higher education institution located in the small city of Khairpur (population range of 50,000-249,999 inhabitants), Sindh. Officially recognized by the Higher Education Commission of Pakistan, Benazir Bhutto Shaheed University of Technology and Skill Development (BBSUTSD) is a coeducational Pakistani higher education institution. Benazir Bhutto Shaheed University of Technology and Skill Development (BBSUTSD) offers courses and programs leading to officially recognized higher education degrees such as bachelor's degrees in several areas of study. See the uniRank degree levels and areas of study table below for further details. This 7-year-old Pakistani higher-education institution has a selective admission policy based on entrance examinations and students' past academic records and grades. BBSUTSD also provides several academic and non-academic facilities and services to students including a library, as well as administrative services.",
    "field": {
      "Arts & Humanities ": ["-", "-", "-", "-"],
      "Language & Cultural ": ["-", "-", "-", "-"],
      "Business & Social Sciences ": ["-", "-", "-", "-"],
      "Medicine & Health ": ["-", "-", "-", "-"],
      "Science & Technology ": ["-", "Bachelor's", "-", "-"],
      "Engineering ": ["-", "Bachelor's", "-", "-"]
    },
    "fee": {
      "Localstudents": ["Not reported", "Not reported"],
      "Internationalstudents": ["Not reported", "Not reported"]
    },
    "image_url": "https://www.4icu.org/i/logos-seals/18791.png"
  },
  {
    "rank": 158,
    "name": "Bolan University of Medical and Health Sciences",
    "location": "Quetta",
    "href": "/reviews/18785.htm",
    "tags": ["public", "non-profit", "very small-sized", "averagely selective"],
    "description": "Founded in 2017, the Bolan University of Medical and Health Sciences is a non-profit public higher education institution located in the urban setting of the metropolis of Quetta (population range of 1,000,000-5,000,000 inhabitants), Balochistan. Officially recognized by the Higher Education Commission of Pakistan, Bolan University of Medical and Health Sciences (BUMHS) is a very small-sized (uniRank enrollment range: 1,000-1,999 students) coeducational Pakistani higher education institution. Bolan University of Medical and Health Sciences (BUMHS) offers courses and programs leading to officially recognized higher education degrees such as bachelor's degrees in several areas of study. See the uniRank degree levels and areas of study table below for further details. This 6-year-old Pakistani higher-education institution has a selective admission policy based on entrance examinations and students' past academic records and grades. The acceptance rate range is 40-49% making this Pakistani higher education organization an averagely selective institution. International students are welcome to apply for enrollment. BUMHS also provides several academic and non-academic facilities and services to students including a library, housing, sports facilities, financial aids and/or scholarships, as well as administrative services.",
    "field": {
      "Arts & Humanities ": ["-", "-", "-", "-"],
      "Language & Cultural ": ["-", "-", "-", "-"],
      "Business & Social Sciences ": ["-", "-", "-", "-"],
      "Medicine & Health ": ["-", "Bachelor's", "-", "-"],
      "Science & Technology ": ["-", "-", "-", "-"],
      "Engineering ": ["-", "-", "-", "-"]
    },
    "fee": {
      "Localstudents": ["0-999 US$(0-910 Euro)", "Not reported"],
      "Internationalstudents": ["0-999 US$(0-910 Euro)", "Not reported"]
    },
    "image_url": "https://www.4icu.org/i/logos-seals/18785.png"
  },
  {
    "rank": 95,
    "name": "Capital University of Science and Technology",
    "location": "Islamabad",
    "href": "/reviews/18788.htm",
    "tags": ["private", "for-profit", "small-sized", "averagely selective"],
    "description": "Established in 1998, the Capital University of Science and Technology is a for-profit private higher education institution located in the rural setting of the metropolis of Islamabad (population range of 1,000,000-5,000,000 inhabitants), Islamabad CT. Officially recognized by the Higher Education Commission of Pakistan, Capital University of Science and Technology (CUST) is a small-sized (uniRank enrollment range: 3,000-3,999 students) coeducational Pakistani higher education institution. Capital University of Science and Technology (CUST) offers courses and programs leading to officially recognized higher education degrees such as bachelor's degrees, master's degrees and doctorate degrees in several areas of study. See the uniRank degree levels and areas of study table below for further details. This 26-year-old Pakistani higher-education institution has a selective admission policy based on entrance examinations and students' past academic records and grades. The acceptance rate range is 50-59% making this Pakistani higher education organization an averagely selective institution. International applicants are eligible to apply for enrollment. CUST also provides several academic and non-academic facilities and services to students including a library, housing, sports facilities, financial aids and/or scholarships, as well as administrative services.",
    "field": {
      "Arts & Humanities ": ["-", "-", "Master's", "Doctorate"],
      "Language & Cultural ": ["-", "-", "Master's", "Doctorate"],
      "Business & Social Sciences ": [
        "-",
        "Bachelor's",
        "Master's",
        "Doctorate"
      ],
      "Medicine & Health ": ["-", "Bachelor's", "Master's", "Doctorate"],
      "Science & Technology ": ["-", "Bachelor's", "Master's", "Doctorate"],
      "Engineering ": ["-", "Bachelor's", "Master's", "Doctorate"]
    },
    "fee": {
      "Localstudents": ["0-999 US$(0-910 Euro)", "0-999 US$(0-910 Euro)"],
      "Internationalstudents": [
        "0-999 US$(0-910 Euro)",
        "0-999 US$(0-910 Euro)"
      ]
    },
    "image_url": "https://www.4icu.org/i/logos-seals/18788.png"
  },
  {
    "rank": 87,
    "name": "CECOS University",
    "location": "Peshawar",
    "href": "/reviews/7569.htm",
    "tags": ["private", "for-profit", "small-sized", "not reported"],
    "description": "Founded in 2001, the CECOS University is a for-profit private higher education institution located in the urban setting of the metropolis of Peshawar (population range of 1,000,000-5,000,000 inhabitants), Khyber Pakhtunkhwa. Officially recognized by the Higher Education Commission of Pakistan, CECOS University (CU) is a small-sized (uniRank enrollment range: 2,000-2,999 students) coeducational Pakistani higher education institution. CECOS University (CU) offers courses and programs leading to officially recognized higher education degrees such as bachelor's degrees in several areas of study. See the uniRank degree levels and areas of study table below for further details. This 22-year-old Pakistani higher-education institution has a selective admission policy based on entrance examinations and students' past academic records and grades. International students are welcome to apply for enrollment. CU also provides several academic and non-academic facilities and services to students including a library, as well as administrative services.",
    "field": {
      "Arts & Humanities ": ["-", "-", "-", "-"],
      "Language & Cultural ": ["-", "-", "-", "-"],
      "Business & Social Sciences ": ["-", "-", "-", "-"],
      "Medicine & Health ": ["-", "-", "-", "-"],
      "Science & Technology ": ["-", "Bachelor's", "-", "-"],
      "Engineering ": ["-", "Bachelor's", "-", "-"]
    },
    "fee": {
      "Localstudents": [
        "1,000-2,499 US$(910-2,280 Euro)",
        "1,000-2,499 US$(910-2,280 Euro)"
      ],
      "Internationalstudents": [
        "1,000-2,499 US$(910-2,280 Euro)",
        "1,000-2,499 US$(910-2,280 Euro)"
      ]
    },
    "image_url": "https://www.4icu.org/i/logos-seals/7569.png"
  },
  {
    "rank": 100,
    "name": "City University of Science and Information Technology",
    "location": "Peshawar",
    "href": "/reviews/7570.htm",
    "tags": [
      "private",
      "non-profit",
      "very small-sized",
      "averagely selective"
    ],
    "description": "Established in 2001, the City University of Science and Information Technology is a non-profit private higher education institution located in the urban setting of the metropolis of Peshawar (population range of 1,000,000-5,000,000 inhabitants), Khyber Pakhtunkhwa. Officially recognized by the Higher Education Commission of Pakistan, City University of Science and Information Technology (CUSIT) is a very small-sized (uniRank enrollment range: 1,000-1,999 students) coeducational Pakistani higher education institution. City University of Science and Information Technology (CUSIT) offers courses and programs leading to officially recognized higher education degrees such as bachelor's degrees, master's degrees and doctorate degrees in several areas of study. See the uniRank degree levels and areas of study table below for further details. This 22-year-old Pakistani higher-education institution has a selective admission policy based on entrance examinations and students' past academic records and grades. The acceptance rate range is 50-59% making this Pakistani higher education organization an averagely selective institution. International applicants are eligible to apply for enrollment. CUSIT also provides several academic and non-academic facilities and services to students including a library, sports facilities, financial aids and/or scholarships, study abroad and exchange programs, as well as administrative services.",
    "field": {
      "Arts & Humanities ": ["-", "Bachelor's", "Master's", "-"],
      "Language & Cultural ": ["-", "-", "-", "-"],
      "Business & Social Sciences ": [
        "-",
        "Bachelor's",
        "Master's",
        "Doctorate"
      ],
      "Medicine & Health ": ["-", "-", "-", "-"],
      "Science & Technology ": ["-", "Bachelor's", "Master's", "-"],
      "Engineering ": ["-", "Bachelor's", "-", "-"]
    },
    "fee": {
      "Localstudents": [
        "2,500-4,999 US$(2,280-4,555 Euro)",
        "1,000-2,499 US$(910-2,280 Euro)"
      ],
      "Internationalstudents": [
        "2,500-4,999 US$(2,280-4,555 Euro)",
        "1,000-2,499 US$(910-2,280 Euro)"
      ]
    },
    "image_url": "https://www.4icu.org/i/logos-seals/7570.png"
  },
  {
    "rank": 171,
    "name": "Commecs Institute of Business and Emerging Sciences",
    "location": "Karachi",
    "href": "/reviews/14623.htm",
    "tags": ["private", "not reported", "very small-sized", "not reported"],
    "description": "Founded in 1993, the Commecs Institute of Business and Emerging Sciences is a private higher education institution located in the large metropolis of Karachi (population range of over 5,000,000 inhabitants), Sindh. Officially recognized by the Higher Education Commission of Pakistan, Commecs Institute of Business and Emerging Sciences (CIBES) is a very small-sized (uniRank enrollment range: under-250 students) coeducational Pakistani higher education institution. Commecs Institute of Business and Emerging Sciences (CIBES) offers courses and programs leading to officially recognized higher education degrees in several areas of study. See the uniRank degree levels and areas of study table below for further details. This 31-year-old Pakistani higher-education institution has a selective admission policy based on entrance examinations and students' past academic records and grades. CIBES also provides several academic and non-academic facilities and services to students including a library, as well as administrative services.",
    "field": {
      "Arts & Humanities ": ["-", "-", "-", "-"],
      "Language & Cultural ": ["-", "-", "-", "-"],
      "Business & Social Sciences ": ["-", "-", "-", "-"],
      "Medicine & Health ": ["-", "-", "-", "-"],
      "Science & Technology ": ["-", "-", "-", "-"],
      "Engineering ": ["-", "-", "-", "-"]
    },
    "fee": {
      "Localstudents": ["Not reported", "Not reported"],
      "Internationalstudents": ["Not reported", "Not reported"]
    },
    "image_url": "https://www.4icu.org/i/logos-seals/14623.png"
  },
  {
    "rank": 5,
    "name": "COMSATS University Islamabad",
    "location": "Islamabad ...",
    "href": "/reviews/3498.htm",
    "tags": ["public", "non-profit", "very large-sized", "very selective"],
    "description": "Established in 2000, the COMSATS University Islamabad is a non-profit public higher education institution located in the suburban setting of the metropolis of Islamabad (population range of 1,000,000-5,000,000 inhabitants), Islamabad CT. This institution also has branch campuses in Abbottabad, Attock, Lahore, Wah, Vehari and Sahiwal. Officially recognized by the Higher Education Commission of Pakistan, COMSATS University Islamabad (CUI) is a very large-sized (uniRank enrollment range: 30,000-34,999 students) coeducational Pakistani higher education institution. COMSATS University Islamabad (CUI) offers courses and programs leading to officially recognized higher education degrees such as bachelor's degrees, master's degrees and doctorate degrees in several areas of study. See the uniRank degree levels and areas of study table below for further details. This 23-year-old Pakistani higher-education institution has a selective admission policy based on entrance examinations and students' past academic records and grades. The acceptance rate range is 30-39% making this Pakistani higher education organization a very selective institution. International applicants are eligible to apply for enrollment. CUI also provides several academic and non-academic facilities and services to students including a library, housing, sports facilities, financial aids and/or scholarships, study abroad and exchange programs, as well as administrative services.",
    "field": {
      "Arts & Humanities ": ["-", "Bachelor's", "-", "-"],
      "Language & Cultural ": ["-", "-", "-", "-"],
      "Business & Social Sciences ": [
        "-",
        "Bachelor's",
        "Master's",
        "Doctorate"
      ],
      "Medicine & Health ": ["-", "Bachelor's", "Master's", "-"],
      "Science & Technology ": ["-", "Bachelor's", "Master's", "Doctorate"],
      "Engineering ": ["-", "Bachelor's", "Master's", "Doctorate"]
    },
    "fee": {
      "Localstudents": ["Not reported", "Not reported"],
      "Internationalstudents": ["Not reported", "Not reported"]
    },
    "image_url": "https://www.4icu.org/i/logos-seals/3498.png"
  }
]
